<?xml version="1.0" encoding="UTF-8"?>
<?xml-stylesheet type="text/xsl" href="page.xsl"?>
<page xmlns="http://benad.me/schema/page"
    xmlns:xsi="http://www.w3.org/2001/XMLSchema-instance"
    xmlns:html="http://www.w3.org/TR/xhtml1/strict"
    xsi:schemaLocation="http://benad.me/schema/page page.xsd">
    
    <!--
    Benad's Web Site by Benoit Nadeau is licensed under a Creative Commons
    Attribution-ShareAlike 4.0 International License
    https://creativecommons.org/licenses/by-sa/4.0/
    -->
    
    <head>
        <title>About This Site - Simplifications</title>
        <id>meta_simplifications</id>
    </head>
    <body>
        <section>
            <p>Since 2023, I simplified the building and deployment of this web site.</p>
            <subsection href="/blog/2023/03/04/the-static-web-site-server/" title="The Static Web Site Server">
                <p>I stopped hosting this site on my own Linux virtual machine, and instead used Azure Static Web App, a free alternative.</p>
            </subsection>
            <subsection href="/blog/2023/06/11/it-goes-to-11-from-hugo-to-11ty/" title="It Goes to 11: From Hugo to 11ty">
                <p>This site is now fully generated by 11ty, within a GitHub Action that both builds and deploys the site each time a change is pushed to my Git repository's main branch.</p>
            </subsection>
            <subsection href="/blog/2026/03/06/oat-and-ai/" title="Oat and AI">
                <p>With some assistance from GitHub Copilot, I replaced this site's CSS using Bootstrap with Oat.</p>
            </subsection>
        </section>
    </body>

</page>
